{
  "schema": "runtime-env/workload/v1",
  "id": "ios-testflight-beta",
  "summary": "Build, sign, and upload an admitted repository revision to TestFlight.",
  "profile": "ios-testflight-ship-local",
  "host": "local-macos",
  "entrypoints": {
    "upload": ["bash", ".agents/skills/ios-testflight-ship/scripts/ship.sh", "<target-repo>", "beta"]
  },
  "entrypoint_environment": {
    "upload": ["APPLE_TEAM_ID", "ASC_ISSUER_ID", "ASC_KEY_ID", "ASC_KEY_PATH", "DEVELOPER_DIR", "IOS_DEVICE_UDID", "JAVA_HOME", "MATCH_PASSWORD"]
  },
  "secret_delivery": "broker-only",
  "agent_secret_access": "denied",
  "mutation": "external-release",
  "evidence": {
    "receipt": "broker-receipts/ios-testflight-beta/<run-id>.json",
    "control": ".agents/skills/ios-testflight-ship/tests/run-all.sh"
  }
}
