{
  "schema": "runtime-env/workload/v1",
  "id": "stealth-browser-mcp",
  "summary": "Serve bounded stealth browser tools while persistent cookie state remains outside the agent filesystem.",
  "profile": "gemini-conversation-research-local",
  "host": "local-macos",
  "entrypoints": {
    "serve": ["npx", "tsx", "<stealth-browser-root>/src/index.ts"],
    "test": ["npm", "test"]
  },
  "entrypoint_environment": {
    "serve": ["DR_CDP_URL", "DR_HEADED", "STEALTH_BROWSER_EXTRA_ALLOW", "STEALTH_BROWSER_ROOT", "STEALTH_PROFILE_ROOT", "STEALTH_DEBUG_LOG", "STEALTH_LANGUAGES", "STEALTH_USER_AGENT"],
    "test": []
  },
  "secret_delivery": "broker-only",
  "agent_secret_access": "denied",
  "mutation": "workspace",
  "evidence": {
    "receipt": "<file-sink>/stealth-browser/<run-id>.json",
    "control": "tests/"
  }
}
